Word,PartsOfSpeech,Meaning
Nonyl,n.,"The hydrocarbon radical, C9H19, derived from nonane and forming many compounds. Used also adjectively; as, nonyl alcohol."
Noose,n.,"A running knot, or loop, which binds the closer the more it is drawn."
Nopal,n.,"A cactaceous plant (Nopalea cochinellifera), originally Mexican, on which the cochineal insect feeds, and from which it is collected. The name is sometimes given to other species of Cactaceae."
Noria,n.,"A large water wheel, turned by the action of a stream against its floats, and carrying at its circumference buckets, by which water is raised and discharged into a trough; used in Arabia, China, and elsewhere for irrigating land; a Persian wheel."
Norie,n.,The cormorant.
Norma,n.,A norm; a principle or rule; a model; a standard.
Norna,n.,"One of the three Fates, Past, Present, and Future. Their names were Urd, Verdandi, and Skuld."
Norse,a.,"Of or pertaining to ancient Scandinavia, or to the language spoken by its inhabitants."
North,n.,"That one of the four cardinal points of the compass, at any place, which lies in the direction of the true meridian, and to the left hand of a person facing the east; the direction opposite to the south."
Nosed,imp. & p. p.,of Nose
Nosel,v. t.,To nurse; to lead or teach; to foster; to nuzzle.
Nosle,n.,Nozzle.
Notal,a.,Of or pertaining to the back; dorsal.
Notch,n.,A hollow cut in anything; a nick; an indentation.
Noted,imp. & p. p.,of Note
Noter,n.,One who takes notice.
Notum,n.,The back.
Notus,n.,The south wind.
Nouch,n.,An ouch; a jewel.
Nould,,Would not.
Noule,n.,The top of the head; the head or noll.
Novel,a.,"Of recent origin or introduction; not ancient; new; hence, out of the ordinary course; unusual; strange; surprising."
Novum,n.,"A game at dice, properly called novem quinque (L., nine five), the two principal throws being nine and five."
Noway,adv.,Alt. of Noways
Nowch,n.,See Nouch.
Nowed,a.,"Knotted; tied in a knot, as a serpent."
Nowel,n.,"Christmas; also, a shout of joy at Christmas for the birth of the Savior."
Nowes,n. pl.,The marriage knot.
Noyau,n.,"A cordial of brandy, etc., flavored with the kernel of the bitter almond, or of the peach stone, etc."
Noyer,n.,An annoyer.
Noyls,n. pl.,See Noils.
Nozle,n.,Nozzle.
Nubia,n.,"A light fabric of wool, worn on the head by women; a cloud."
Nuch/,pl. ,of Nucha
Nucha,n.,The back or upper part of the neck; the nape.
Nucin,n.,See Juglone.
Nucle,n.,Same as Nutlet.
Nudge,v. t.,"To touch gently, as with the elbow, in order to call attention or convey intimation."
Nugae,n. pl.,Trifles; jests.
Oaken,a.,Made or consisting of oaks or of the wood of oaks.
Oaker,n.,See Ocher.
Oakum,n.,"The material obtained by untwisting and picking into loose fiber old hemp ropes; -- used for calking the seams of ships, stopping leaks, etc."
Oared,imp. & p. p.,of Oar
Oases,pl. ,of Oasis
Oasis,n.,"A fertile or green spot in a waste or desert, esp. in a sandy desert."
Oaten,a.,"Consisting of an oat straw or stem; as, an oaten pipe."
Oaths,pl. ,of Oath
Obeah,n.,Same as Obi.
Paage,n.,A toll for passage over another person's grounds.
Paard,n.,The zebra.
Paced,imp. & p. p.,of Pace
Pacer,n.,"One who, or that which, paces; especially, a horse that paces."
Pacha,n.,See Pasha.
Pacos,n.,Same as Alpaca.
Padar,n.,Groats; coarse flour or meal.
Paddy,a.,Low; mean; boorish; vagabond.
Padge,n.,"The barn owl; -- called also pudge, and pudge owl."
Padow,n.,"A paddock, or toad."
Paean,n.,"An ancient Greek hymn in honor of Apollo as a healing deity, and, later, a song addressed to other deities."
Paeon,n.,"A foot of four syllables, one long and three short, admitting of four combinations, according to the place of the long syllable."
Pagan,n.,"One who worships false gods; an idolater; a heathen; one who is neither a Christian, a Mohammedan, nor a Jew."
Paged,imp. & p. p.,of Page
Pagod,n.,"A pagoda. [R.] ""Or some queer pagod."""
Paien,n. & a.,Pagan.
Pains,n.,"Labor; toilsome effort; care or trouble taken; -- plural in form, but used with a singular or plural verb, commonly the former."
Paint,v. t.,"To cover with coloring matter; to apply paint to; as, to paint a house, a signboard, etc."
Paise,n.,See Poise.
Paled,imp. & p. p.,of Pale
Palea,n.,The interior chaff or husk of grasses.
Palet,n.,Same as Palea.
Palla,n.,"An oblong rectangular piece of cloth, worn by Roman ladies, and fastened with brooches."
Quack,v. i.,To utter a sound like the cry of a duck.
Quade,a.,"Evil; bad; baffling; as, a quade wind."
Raash,n.,The electric catfish.
Rabat,n.,A polishing material made of potter's clay that has failed in baking.
Rabbi,n.,Master; lord; teacher; -- a Jewish title of respect or honor for a teacher or doctor of the law.
Rabid,n.,Furious; raging; extremely violent.
Rabot,n.,A rubber of hard wood used in smoothing marble to be polished.
Raced,imp. & p. p.,of Race
Racer,n.,"One who, or that which, races, or contends in a race; esp., a race horse."
Rache,n.,"A dog that pursued his prey by scent, as distinguished from the greyhound."
Racle,a.,See Rakel.
Radde,,"imp. of Read, Rede."
Radii,n.,pl. of Radius.
Radix,n.,"A primitive word, from which spring other words; a radical; a root; an etymon."
Rafte,,imp. of Reave.
Rafty,a.,Damp; musty.
Raged,imp. & p. p.,of Rage
Raggy,a.,Ragged; rough.
Raiae,n. pl.,"The order of elasmobranch fishes which includes the sawfishes, skates, and rays; -- called also Rajae, and Rajii."
Rainy,a.,"Abounding with rain; wet; showery; as, rainy weather; a rainy day or season."
Raise,v. t.,"To cause to rise; to bring from a lower to a higher place; to lift upward; to elevate; to heave; as, to raise a stone or weight."
Rajah,a.,"A native prince or king; also, a landholder or person of importance in the agricultural districts."
Raked,imp. & p. p.,of Rake
Rakel,a.,Hasty; reckless; rash.
Raker,n.,"One who, or that which, rakes"
Rally,v. t.,"To collect, and reduce to order, as troops dispersed or thrown into confusion; to gather again; to reunite."
Ralph,n.,A name sometimes given to the raven.
Ramal,a.,"Of or pertaining to a ramus, or branch; rameal."
Ramed,a.,"Having the frames, stem, and sternpost adjusted; -- said of a ship on the stocks."
Ramee,n.,See Ramie.
Ramie,n.,"The grass-cloth plant (B/hmeria nivea); also, its fiber, which is very fine and exceedingly strong; -- called also China grass, and rhea. See Grass-cloth plant, under Grass."
Rammy,a.,Like a ram; rammish.
Rampe,n.,The cuckoopint.
Ramus,n.,A branch; a projecting part or prominent process; a ramification.
Ranal,a.,Having a general affinity to ranunculaceous plants.
Rance,n.,A prop or shore.
Ranch,v. t.,To wrench; to tear; to sprain; to injure by violent straining or contortion.
Ranee,n.,Same as Rani.
Range,n.,"To set in a row, or in rows; to place in a regular line or lines, or in ranks; to dispose in the proper order; to rank; as, to range soldiers in line."
Ranny,n.,The erd shrew.
Ranty,a.,Wild; noisy; boisterous.
Raphe,n.,"A line, ridge, furrow, or band of fibers, especially in the median line; as, the raphe of the tongue."
Rapid,a.,"Very swift or quick; moving with celerity; fast; as, a rapid stream; a rapid flight; a rapid motion."
Rased,imp. & p. p.,of Rase
Raspy,a.,"Like a rasp, or the sound made by a rasp; grating."
Rasse,n.,"A carnivore (Viverricula Mallaccensis) allied to the civet but smaller, native of China and the East Indies."
Ratan,n.,See Rattan.
Ratch,n.,Same as Rotche.
Rated,imp. & p. p.,of Rate
Ratel,n.,"Any carnivore of the genus Mellivora, allied to the weasels and the skunks; -- called also honey badger."
Rater,n.,One who rates or estimates.
Rathe,a.,"Coming before others, or before the usual time; early."
Ratio,n.,The relation which one quantity or magnitude has to another of the same kind. It is expressed by the quotient of the division of the first by the second; 
Raton,n.,A small rat.
Raved,imp. & p. p.,of Rave
Ravel,v. t.,"To separate or undo the texture of; to take apart; to untwist; to unweave or unknit; -- often followed by out; as, to ravel a twist; to ravel out a stocking."
Raven,n.,"A large black passerine bird (Corvus corax), similar to the crow, but larger. It is native of the northern parts of Europe, Asia, and America, and is noted for its sagacity."
Raver,n.,One who raves.
Ravin,a.,Ravenous.
Rawly,adv.,In a raw manner; unskillfully; without experience.
Rayed,imp. & p. p.,of Ray
Rayah,n.,"A person not a Mohammedan, who pays the capitation tax."
Rayon,n.,Ray; beam.
Razed,imp. & p. p.,of Raze
Razee,v. t.,"An armed ship having her upper deck cut away, and thus reduced to the next inferior rate, as a seventy-four cut down to a frigate."
Razor,v. t.,"A keen-edged knife of peculiar shape, used in shaving the hair from the face or the head."
Reach,v. i.,To retch.
React,v. t.,"To act or perform a second time; to do over again; as, to react a play; the same scenes were reacted at Rome."
Ready,superl.,Prepared for what one is about to do or experience; 
Realm,n.,A royal jurisdiction or domain; a region which is under the dominion of a king; a kingdom.
Reame,n.,Realm.
Reata,n.,A lariat.
Reave,v. i.,To take away by violence or by stealth; to snatch away; to rob; to despoil; to bereave. [Archaic]
Rebec,n.,"An instrument formerly used which somewhat resembled the violin, having three strings, and being played with a bow."
Rebel,v. i.,"Pertaining to rebels or rebellion; acting in revolt; rebellious; as, rebel troops."
Rebus,n.,A mode of expressing words and phrases by pictures of objects whose names resemble those words
Rebut,v. t.,To drive or beat back; to repulse.
Recto,n.,A writ of right.
Recti,pl. ,of Rectus
Recur,v. i.,To come back; to return again or repeatedly; to come again to mind.
Redan,n.,A work having two parapets whose faces unite so as to form a salient angle toward the enemy.
Redde,,"obs. imp. of Read, or Rede."
Redia,n.,"A kind of larva, or nurse, which is prroduced within the sporocyst of certain trematodes by asexual generation."
Redly,adv.,In a red manner; with redness.
Redub,v. t.,"To refit; to repair, or make reparation for; hence, to repay or requite."
Reedy,a.,Abounding with reeds; covered with reeds.
Reefy,a.,Full of reefs or rocks.
Reeky,a.,Soiled with smoke or steam; smoky; foul.
Reeve,n.,The female of the ruff.
Refar,v. t.,To go over again; to repeat.
Refel,v. t.,"To refute; to disprove; as, to refel the tricks of a sophister."
Refer,v. t.,To carry or send back.
Refit,v. t.,"To fit or prepare for use again; to repair; to restore after damage or decay; as, to refit a garment; to refit ships of war."
Refix,v. t.,To fix again or anew; to establish anew.
Refut,n.,Refuge.
Regal,a.,"Of or pertaining to a king; kingly; royal; as, regal authority, pomp, or sway."
Regel,n.,See Rigel.
Reget,v. t.,To get again.
Regle,v. t.,To rule; to govern.
Regma,n.,"A kind of dry fruit, consisting of three or more cells, each which at length breaks open at the inner angle."
Regne,n. & v.,See Reign.
Reign,n.,Royal authority; supreme power; sovereignty; rule; dominion.
Reins,n. pl.,"The kidneys; also, the region of the kidneys; the loins."
Rekne,v. t.,To reckon.
Relax,n.,"To make lax or loose; to make less close, firm, rigid, tense, or the like; to slacken; to loosen; to open; as, to relax a rope or cord; to relax the muscles or sinews."
Relay,v. t.,"To lay again; to lay a second time; as, to relay a pavement."
Relic,n.,That which remains; that which is left after loss or decay; a remaining portion; a remnant.
Relik,n.,Relic.
Remit,v. t.,To send back; to give up; to surrender; to resign.
Remix,v. t.,To mix again or repeatedly.
Remue,v. t.,To remove.
Renal,a.,Of or pertaining to the kidneys; in the region of the kidneys.
Renay,v. t.,To deny; to disown.
Renew,v. t.,"To make new again; to restore to freshness, perfection, or vigor; to give new life to; to rejuvenate; to re/stablish; to recreate; to rebuild."
Renne,v. t.,"To plunder; -- only in the phrase ""to rape and renne."" See under Rap, v. t., to snatch."
Rente,n.,"In France, interest payable by government on indebtedness; the bonds, shares, stocks, etc., which represent government indebtedness."
Repay,v. t.,"To pay back; to refund; as, to repay money borrowed or advanced."
Repel,v. t.,"To drive back; to force to return; to check the advance of; to repulse as, to repel an enemy or an assailant."
Reply,v. i.,To make a return in words or writing; to respond; to answer.
Resaw,v. t.,"To saw again; specifically, to saw a balk, or a timber, which has already been squared, into dimension lumber, as joists, boards, etc."
Reset,v. t.,"To set again; as, to reset type; to reset copy; to reset a diamond."
Resin,n.,"Any one of a class of yellowish brown solid inflammable substances, of vegetable origin, "
Resow,v. t.,To sow again.
Resty,a.,"Disposed to rest; indisposed toexercton; sluggish; also, restive."
Retch,v. i.,"To make an effort to vomit; to strain, as in vomiting."
Retex,v. t.,"To annual, as orders."
Retry,v. t.,"To try (esp. judicially) a second time; as, to retry a case; to retry an accused person."
Rette,v. t.,See Aret.
Reule,n.& v.,Rule.
Reume,n.,Realm.
Revel,n.,See Reveal.
Revet,v. t.,"To face, as an embankment, with masonry, wood, or other material."
Revie,v. t.,"To vie with, or rival, in return."
Rewet,n.,A gunlock.
Rewin,v. t.,"To win again, or win back."
Rewle,n. & v.,Rule.
Rewme,n.,Realm.
Rewth,n.,Ruth.
Reges,pl. ,of Rex
Reyse,v. t.,To raise.
Rheae,n. pl.,A suborder of struthious birds including the rheas.
Rheic,a.,"Pertaining to, or designating, an acid (commonly called chrysophanic acid) found in rhubarb (Rheum)."
Rhein,n.,Chrysophanic acid.
Rheum,n.,A genus of plants. See Rhubarb.
Rhime,n.,See Rhyme.
Rhine,n.,A water course; a ditch.
Rhino,n.,"Gold and silver, or money."
Rhomb,n.,"An equilateral parallelogram, or quadrilateral figure whose sides are equal and the opposite sides parallel. The angles may be unequal, two being obtuse and two acute, as in the cut, or the angles may be equal, in which case it is usually called a square."
Rhumb,n.,"A line which crosses successive meridians at a constant angle; -- called also rhumb line, and loxodromic curve. See Loxodromic."
Rhyme,n.,"An expression of thought in numbers, measure, or verse; a composition in verse; a rhymed tale; poetry; harmony of language."
Riant,a.,"Laughing; laughable; exciting gayety; gay; merry; delightful to the view, as a landscape."
Riban,n.,See Ribbon.
Ribes,n.,A genus of shrubs including gooseberries and currants of many kinds.
Riden,,imp. pl. &amp; p. p. of Ride.
Rider,n.,"One who, or that which, rides."
Ridge,n.,"The back, or top of the back; a crest."
Ridgy,a.,Having a ridge or ridges; rising in a ridge.
Rifle,v. t.,To seize and bear away by force; to snatch away; to carry off.
Rigel,n.,A fixed star of the first magnitude in the left foot of the constellation Orion.
Right,a.,"Straight; direct; not crooked; as, a right line."
Rigid,a.,Firm; stiff; unyielding; not pliant; not flexible.
Rigol,n.,"A circle; hence, a diadem."
Rigor,n.,Rigidity; stiffness.
Riled,imp. & p. p.,of Rile
Rille,n.,"One of certain narrow, crooked valleys seen, by aid of the telescope, on the surface of the moon."
Rimae,pl. ,of Rima
Rimed,imp. & p. p.,of Rime
Rimer,n.,A rhymer; a versifier.
Rimey,v. t.,To compose in rhyme; to versify.
Rindy,a.,Having a rind or skin.
Rined,a.,Having a rind
Rinse,v. t.,To wash lightly; to cleanse with a second or repeated application of water after washing.
Ripen,v. i.,"To grow ripe; to become mature, as grain, fruit, flowers, and the like; as, grapes ripen in the sun."
Risen,p. p.,of Rise
Riser,n.,"One who rises; as, an early riser."
Risky,a.,Attended with risk or danger; hazardous.
Risse,,imp. of Rise.
Rival,n.,A person having a common right or privilege with another; a partner.
Rived,imp.,of Rive
Riven,,of Rive
Rivel,v. t.,"To contract into wrinkles; to shrivel; to shrink; as, riveled fruit; riveled flowers."
River,n.,One who rives or splits.
Rivet,n.,"A metallic pin with a head, used for uniting two plates or pieces of material together, by passing it through them and then beating or pressing down the point so that it shall spread out and form a second head; a pin or bolt headed or clinched at both ends."
Roach,n.,A cockroach.
Roast,v. t.,"To cook by exposure to radiant heat before a fire; as, to roast meat on a spit, or in an oven open toward the fire and having reflecting surfaces within; also, to cook in a close oven."
Robed,imp. & p. p.,of Robe
Robin,n.,"A small European singing bird (Erythacus rubecula), having a reddish breast; -- called also robin redbreast, robinet, and ruddock."
Roche,n.,Rock.
Rocky,a.,"Full of, or abounding in, rocks; consisting of rocks; as, a rocky mountain; a rocky shore."
Rocoa,n.,"The orange-colored pulp covering the seeds of the tropical plant Bixa Orellana, from which annotto is prepared. See Annoto."
Roddy,a.,Full of rods or twigs.
Rodeo,n.,A round-up. See Round-up.
Rodge,n.,The gadwall.
Rogue,n.,"A vagrant; an idle, sturdy beggar; a vagabond; a tramp."
Roguy,a.,Roguish.
Rohob,n.,An inspissated juice. See Rob.
Roial,a.,Royal.
Roily,a.,"Turbid; as, roily water."
Roint,interj.,See Aroint.
Roist,v. i.,See Roister.
Rokee,n.,"Parched Indian corn, pounded up and mixed with sugar; -- called also yokeage."
Roman,a.,"Of or pertaining to Rome, or the Roman people; like or characteristic of Rome, the Roman people, or things done by Romans; as, Roman fortitude; a Roman aqueduct; Roman art."
Romic,n.,"A method of notation for all spoken sounds, proposed by Mr. Sweet; -- so called because it is based on the common Roman-letter alphabet. It is like the palaeotype of Mr. Ellis in the general plan, but simpler."
Rompu,a.,"Broken, as an ordinary; cut off, or broken at the top, as a chevron, a bend, or the like."
Ronco,n.,"See Croaker, n., 2. (a)."
Ronde,n.,"A kind of script in which the heavy strokes are nearly upright, giving the characters when taken together a round look."
Rondo,n.,"A composition, vocal or instrumental, commonly of a lively, cheerful character, in which the first strain recurs after each of the other strains."
Ronne,,obs. imp. pl.
Roody,a.,Rank in growth.
Roofy,a.,Having roofs.
Rooky,a.,Misty; gloomy.
Roomy,a.,"Having ample room; spacious; large; as, a roomy mansion; a roomy deck."
Roost,n.,Roast.
Rooty,a.,"Full of roots; as, rooty ground."
Roped,imp. & p. p.,of Rope
Roper,n.,A maker of ropes.
Roral,a.,Of or pertaining to dew; consisting of dew; dewy.
Roric,a.,Of or pertaining to dew; resembling dew; dewy.
Rorid,a.,Dewy; bedewed.
Rosen,a.,Consisting of roses; rosy.
Roser,n.,A rosier; a rosebush.
Roset,n.,A red color used by painters.
Rosin,n.,"The hard, amber-colored resin left after distilling off the volatile oil of turpentine; colophony."
Rotal,a.,Relating to wheels or to rotary motion; rotary.
Roted,imp. & p. p.,of Rote
Rotta,n.,See Rota.
Rouet,n.,A small wheel formerly fixed to the pan of firelocks for discharging them.
Rouge,a.,red.
Rough,n.,"Having inequalities, small ridges, or points, on the surface; not smooth or plain; as, a rough board; a rough stone; rough cloth."
Round,v. i. & t.,To whisper.
Rouse,v. i. & t.,"To pull or haul strongly and all together, as upon a rope, without the assistance of mechanical appliances."
Roust,v. t.,"To rouse; to disturb; as, to roust one out."
Route,n.,"The course or way which is traveled or passed, or is to be passed; a passing; a course; a road or path; a march."
Roved,imp. & p. p.,of Rove
Rover,v. i.,One who practices robbery on the seas; a pirate.
Rowed,imp. & p. p.,of Row
Rowan,n.,Rowan tree.
Rowdy,n.,"One who engages in rows, or noisy quarrels; a ruffianly fellow."
Rowel,n.,"The little wheel of a spur, with sharp points."
Rowen,n.,"A stubble field left unplowed till late in the autumn, that it may be cropped by cattle."
Rower,n.,One who rows with an oar.
Royal,a.,"Kingly; pertaining to the crown or the sovereign; suitable for a king or queen; regal; as, royal power or prerogative; royal domains; the royal family; royal state."
Royne,v. t.,To bite; to gnaw.
Rubin,n.,A ruby.
Ruble,n.,"The unit of monetary value in Russia.  It is divided into 100 copecks, and in the gold coin of the realm (as in the five and ten ruble pieces) is worth about 77 cents. The silver ruble is a coin worth about 60 cents."
Rubus,n.,"A genus of rosaceous plants, including the raspberry and blackberry."
Ruche,n.,"A plaited, quilled, or goffered strip of lace, net, ribbon, or other material, -- used in place of collars or cuffs, and as a trimming for women's dresses and bonnets."
Ruddy,n.,"Of a red color; red, or reddish; as, a ruddy sky; a ruddy flame."
Ruing,p. pr. & vb. n.,of Rue
Ruffe,n.,"A small freshwater European perch (Acerina vulgaris); -- called also pope, blacktail, and stone, / striped, perch."
Rufol,n.,"A phenol derivative of anthracene obtained as a white crystalline substance, which on oxidation produces a red dyestuff related to anthraquinone."
Rugae,pl. ,of Ruga
Ruggy,a.,Rugged; rough.
Rugin,n.,A nappy cloth.
Ruled,imp. & p. p.,of Rule
Ruler,n.,One who rules; one who exercises sway or authority; a governor.
Rumbo,n.,Grog.
Rumen,n.,The first stomach of ruminants; the paunch; the fardingbag. See Illust. below. 
Rummy,a.,Of or pertaining to rum; characteristic of rum; as a rummy flavor.
Rumor,n.,"A flying or popular report; the common talk; hence, public fame; notoriety."
Runch,n.,The wild radish.
Runer,n.,"A bard, or learned man, among the ancient Goths."
Runic,a.,"Of or pertaining to a rune, to runes, or to the Norsemen; as, runic verses; runic letters; runic names; runic rhyme."
Runty,a.,Like a runt; diminutive; mean.
Rupee,n.,"A silver coin, and money of account, in the East Indies."
Rupia,n.,"An eruption upon the skin, consisting of vesicles with inflamed base and filled with serous, purulent, or bloody fluid, which dries up, forming a blackish crust."
Rural,a.,"Of or pertaining to the country, as distinguished from a city or town; living in the country; suitable for, or resembling, the country; rustic; as, rural scenes; a rural prospect."
Rushy,a.,Abounding with rushes.
Rusma,n.,"A depilatory made of orpiment and quicklime, and used by the Turks. See Rhusma."
Rusty,superl.,"Covered or affected with rust; as, a rusty knife or sword; rusty wheat."
Rutic,a.,"Pertaining to, or obtained from, rue (Ruta); as, rutic acid, now commonly called capric acid."
Rutin,n.,"A glucoside resembling, but distinct from, quercitrin. Rutin is found in the leaves of the rue (Ruta graveolens) and other plants, and obtained as a bitter yellow crystalline substance which yields quercitin on decomposition."
Rutty,a.,Ruttish; lustful.
Ryder,n.,A clause added to a document; a rider. See Rider.
Saadh,n.,See Sadh.
Sabal,n.,A genus of palm trees including the palmetto of the Southern United States.
Saber,n.,Alt. of Sabre
Sabre,n.,"A sword with a broad and heavy blade, thick at the back, and usually more or less curved like a scimiter; a cavalry sword."
Sable,n.,"A carnivorous animal of the Weasel family (Mustela zibellina) native of the northern latitudes of Europe, Asia, and America, -- noted for its fine, soft, and valuable fur."
Sabot,n.,"A kind of wooden shoe worn by the peasantry in France, Belgium, Sweden, and some other European countries."
Sacar,n.,See Saker.
Sacci,pl. ,of Saccus
Sacre,n.,See Saker.
sacra,pl. ,of Sacrum
Sadda,n.,"A work in the Persian tongue, being a summary of the Zend-Avesta, or sacred books."
Sadly,adv.,Wearily; heavily; firmly.
Sagas,pl. ,of Saga
Sagum,n.,The military cloak of the Roman soldiers.
Sagus,n.,A genus of palms from which sago is obtained.
Sahib,n.,Alt. of Saheb
Saheb,n.,A respectful title or appellation given to Europeans of rank.
Sahui,n.,A marmoset.
Saiga,n.,"An antelope (Saiga Tartarica) native of the plains of Siberia and Eastern Russia. The male has erect annulated horns, and tufts of long hair beneath the eyes and ears."
Saily,a.,Like a sail.
Saint,n.,"A person sanctified; a holy or godly person; one eminent for piety and virtue; any true Christian, as being redeemed and consecrated to God."
Saith,,3d pers. sing. pres. of Say.
Saiva,n.,One of an important religious sect in India which regards Siva with peculiar veneration.
Sajou,n.,Same as Sapajou.
Saker,n.,"A falcon (Falco sacer) native of Southern Europe and Asia, closely resembling the lanner."
Sakti,n.,"The divine energy, personified as the wife of a deity (Brahma, Vishnu, Siva, etc.); the female principle."
Salad,n.,"A preparation of vegetables, as lettuce, celery, water cress, onions, etc., usually dressed with salt, vinegar, oil, and spice, and eaten for giving a relish to other food; as, lettuce salad; tomato salad, etc."
Salam,n.,"A salutation or compliment of ceremony in the east by word or act; an obeisance, performed by bowing very low and placing the right palm on the forehead."
Saleb,n.,See Salep.
Salep,n.,"The dried tubers of various species of Orchis, and Eulophia. It is used to make a nutritious beverage by treating the powdered preparation with hot water."
Salic,a.,"Of or pertaining to the Salian Franks, or to the Salic law so called."
Salix,n.,"A genus of trees or shrubs including the willow, osier, and the like, growing usually in wet grounds."
Sally,v. i.,To leap or rush out; to burst forth; to issue suddenly; as a body of troops from a fortified place to attack besiegers; to make a sally.
Salmi,n.,Same as Salmis.
Salol,n.,A white crystalline substance consisting of phenol salicylate.
Salon,n.,"An apartment for the reception of company; hence, in the plural, fashionable parties; circles of fashionable society."
Salpa,n.,"A genus of transparent, tubular, free-swimming oceanic tunicates found abundantly in all the warmer latitudes. See Illustration in Appendix."
Salse,n.,"A mud volcano, the water of which is often impregnated with salts, whence the name."
Salty,a.,Somewhat salt; saltish.
Salue,v. t.,To salute.
Salve,interj.,Hail!
Salvo,n.,An exception; a reservation; an excuse.
Sambo,n.,"A colloquial or humorous appellation for a negro; sometimes, the offspring of a black person and a mulatto; a zambo."
