Word,PartsOfSpeech,Meaning
Goose,n.,"Any large web-footen bird of the subfamily Anserinae, and belonging to Anser, Branta, Chen, and several allied genera. See Anseres."
Goost,n.,Ghost; spirit.
Goral,n.,"An Indian goat antelope (Nemorhedus goral), resembling the chamois."
Gorce,n.,A pool of water to keep fish in; a wear.
Gored,imp. & p. p.,of Gore
Gorge,n.,The throat; the gullet; the canal by which food passes to the stomach.
Gorma,n.,The European cormorant.
Gorse,n.,Furze. See Furze.
Goter,n.,a gutter.
Gouge,n.,"A chisel, with a hollow or semicylindrical blade, for scooping or cutting holes, channels, or grooves, in wood, stone, etc.; a similar instrument, with curved edge, for turning wood."
Bouge,v. t.,To scoop out with a gouge.
Goura,n.,"One of several species of large, crested ground pigeons of the genus Goura, inhabiting New Guinea and adjacent islands. "
Gourd,n.,"A fleshy, three-celled, many-seeded fruit, "
Gouty,a.,"Diseased with, or subject to, the gout; as, a gouty person; a gouty joint."
Gowan,n.,"The daisy, or mountain daisy."
Graal,n.,"See Grail., a dish."
Grace,n.,"The exercise of love, kindness, mercy, favor; disposition to benefit or serve another; favor bestowed or privilege conferred."
Grade,n.,"A step or degree in any series, rank, quality, order; relative position or standing; as, grades of military rank; crimes of every grade; grades of flour."
Graff,n.,A steward; an overseer.
Graft,n.,"A small shoot or scion of a tree inserted in another tree, the stock of which is to support and nourish it. The two unite and become one tree, but the graft determines the kind of fruit."
Grail,n.,A book of offices in the Roman Catholic Church; a gradual.
Grain,v. & n.,See Groan.
Graip,n.,A dungfork.
Grame,a.,Anger; wrath; scorn.
Grand,superl.,"Of large size or extent; great; extensive; hence, relatively great; greatest; chief; principal; as, a grand mountain; a grand army; a grand mistake."
Grane,v. & n.,See Groan.
Grant,v. t.,To give over; to make conveyance of; to give the possession or title of; to convey; -- usually in answer to petition.
Grape,n.,"A well-known edible berry growing in pendent clusters or bunches on the grapevine. The berries are smooth-skinned, have a juicy pulp, and are cultivated in great quantities for table use and for making wine and raisins."
Grapy,a.,"Composed of, or resembling, grapes."
Grasp,v. t.,To seize and hold by clasping or embracing with the fingers or arms; to catch to take possession of.
Grass,n.,Popularly: Herbage; the plants which constitute the food of cattle and other beasts; pasture.
Grate,a.,Serving to gratify; agreeable.
Grave,v. t.,"To clean, as a vessel's bottom, of barnacles, grass, etc., and pay it over with pitch; -- so called because graves or greaves was formerly used for this purpose."
Gravy,n.,"The juice or other liquid matter that drips from flesh in cooking, made into a dressing for the food when served up."
Graze,v. t.,"To feed or supply (cattle, sheep, etc.) with grass; to furnish pasture for."
Great,superl.,"Large in space; of much size; big; immense; enormous; expanded; -- opposed to small and little; as, a great house, ship, farm, plain, distance, length."
Grebe,n.,"One of several swimming birds or divers, of the genus Colymbus (formerly Podiceps), and allied genera, found in the northern parts of America, Europe, and Asia. They have strong, sharp bills, and lobate toes."
Grees,pl. ,of Gree
Grice,pl. ,of Gree
Grise,pl. ,of Gree
Grize,pl. ,of Gree
Greed,n.,"An eager desire or longing; greediness; as, a greed of gain."
Greek,a.,Of or pertaining to Greece or the Greeks; Grecian.
Green,superl.,Having the color of grass when fresh and growing; resembling that color of the solar spectrum which is between the yellow and the blue; verdant; emerald.
Greet,a.,Great.
Grege,v. t.,Alt. of Gregge
Grego,n.,"A short jacket or cloak, made of very thick, coarse cloth, with a hood attached, worn by the Greeks and others in the Levant."
Greit,v. i.,"See Greet, to weep."
Grene,a.,Green.
Grete,a.,Great.
Greve,n.,A grove.
Gride,e. i.,"To cut with a grating sound; to cut; to penetrate or pierce harshly; as, the griding sword."
Grief,a.,"Pain of mind on account of something in the past; mental suffering arising from any cause, as misfortune, loss of friends, misconduct of one's self or others, etc.; sorrow; sadness."
Griff,n.,Grasp; reach.
Grill,v. t.,A gridiron.
Grime,n.,"Foul matter; dirt, rubbed in; sullying blackness, deeply ingrained."
Grimy,superl.,Full of grime; begrimed; dirty; foul.
Grind,v. t.,"To reduce to powder by friction, as in a mill, or with the teeth; to crush into small fragments; to produce as by the action of millstones."
Grint,,"3d pers. sing. pres. of Grind, contr. from grindeth."
Gripe,n.,A vulture; the griffin.
Grist,n.,"Ground corn; that which is ground at one time; as much grain as is carried to the mill at one time, or the meal it produces."
Grith,n.,Peace; security; agreement.
Groan,v. i.,"To give forth a low, moaning sound in breathing; to utter a groan, as in pain, in sorrow, or in derision; to moan."
Groat,n.,"An old English silver coin, equal to four pence."
Groin,n.,The snout of a swine.
Grond,,obs. imp. of Grind.
Groom,n.,"A boy or young man; a waiter; a servant; especially, a man or boy who has charge of horses, or the stable."
Grope,v. i.,To feel with or use the hands; to handle.
Gross,superl.,Great; large; bulky; fat; of huge size; excessively large.
Grote,n.,A groat.
Group,n.,"A cluster, crowd, or throng; an assemblage, either of persons or things, collected without any regular form or arrangement; as, a group of men or of trees; a group of isles."
Grout,n.,Coarse meal; ground malt; pl. groats.
Grove,v.,"A smaller group of trees than a forest, and without underwood, planted, or growing naturally as if arranged by art; a wood of small extent."
Grovy,a.,"Pertaining to, or resembling, a grove; situated in, or frequenting, groves."
Growl,v. i.,"To utter a deep guttural sound, sa an angry dog; to give forth an angry, grumbling sound."
Grown,,p. p. of Grow.
Gruel,n.,"A light, liquid food, made by boiling meal of maize, oatmeal, or fiour in water or milk; thin porridge."
Gruff,superl.,"Of a rough or stern manner, voice, or countenance; sour; surly; severe; harsh."
Grume,n.,"A thick, viscid fluid; a clot, as of blood."
Grunt,v. t.,"To make a deep, short noise, as a hog; to utter a short groan or a deep guttural sound."
Gryde,v. i.,To gride. See Gride.
Grype,v. t.,To gripe.
Guaco,n.,"A plant (Aristolochia anguicida) of Carthagena, used as an antidote to serpent bites."
Guana,n.,See Iguana.
Guano,n.,A substance found in great abundance on some coasts or islands frequented by sea fowl
Guara,n.,The scarlet ibis. See Ibis.
Guard,n.,To protect from danger;
Guava,n.,"A tropical tree, or its fruit, of the genus Psidium. "
Guelf,n.,"One of a faction in Germany and Italy, in the 12th and 13th centuries, which supported the House of Guelph and the pope"
Guess,v. t.,"To form an opinion concerning, without knowledge or means of knowledge; to judge of at random; to conjecture."
Guest,n.,A visitor; a person received and entertained in one's house or at one's table; a visitor entertained without pay.
Guiac,n.,Same as Guaiac.
Gulge,n.,See Gige.
Guild,v. t.,"An association of men belonging to the same class, or engaged in kindred pursuits, "
Guile,n.,Craft; deceitful cunning; artifice; duplicity; wile; deceit; treachery.
Guilt,v. t.,"The criminality and consequent exposure to punishment resulting from willful disobedience of law, "
Guise,n.,Customary way of speaking or acting; custom;
GulAe,pl. ,of Gula
Gulas,pl. ,of Gula
Gular,a.,"Pertaining to the gula or throat; as, gular plates. See Illust. of Bird, and Bowfin."
Gulch,n.,Act of gulching or gulping.
Gules,n.,"The tincture red, indicated in seals and engraved figures of escutcheons by parallel vertical lines. Hence, used poetically for a red color or that which is red."
Gulfy,a.,Full of whirlpools or gulfs.
Gully,n.,A large knife.
Gulph,n.,See Gulf.
Gulty,a.,Guilty.
Gumbo,n.,A soup thickened with the mucilaginous pods of the okra; okra soup.
Gumma,n.,"A kind of soft tumor, usually of syphilitic origin."
Gummy,a.,Consisting of gum; viscous; adhesive; producing or containing gum; covered with gum or a substance resembling gum.
Gunny,,Alt. of Gunny cloth
Gurge,n.,A whirlpool.
Gurmy,n.,A level; a working.
Gurry,n.,"An alvine evacuation; also, refuse matter."
Gurts,n. pl.,Groatts.
Gusto,n.,Nice or keen appreciation or enjoyment; relish; taste; fancy.
Gusty,a.,"Subject to, or characterized by, gusts or squalls; windy; stormy; tempestuous."
Gutta,n.,A drop.
Gutty,a.,Charged or sprinkled with drops.
Guyed,imp. & p. p.,of Guy
Guyle,v. t.,To guile.
Gyall,n.,See Gayal.
Gybed,imp. & p. p.,of Gybe
Gynno,v. i.,To begin. See Gin.
Gypse,n.,See Gypsum.
Gypsy,n.,"One of a vagabond race, whose tribes, coming originally from India,"
Gyral,a.,Moving in a circular path or way; whirling; gyratory.
Gyron,n.,A subordinary of triangular form having one of its angles at the fess point and the opposite aide at the edge of the escutcheon. 
Gyrus,n.,"A convoluted ridge between grooves; a convolution; as, the gyri of the brain; the gyri of brain coral.  See Brain."
Habit,n.,"The usual condition or state of a person or thing, either natural or acquired"
Hable,a.,See Habile.
Hades,n.,"The nether world (according to classical mythology, the abode of the shades, ruled over by Hades or Pluto); the invisible world; the grave."
Hadji,n.,A Mohammedan pilgrim to Mecca; -- used among Orientals as a respectful salutation or a title of honor.
Ha-ha,n.,"A sunk fence; a fence, wall, or ditch, not visible till one is close upon it."
Haily,a.,Of hail.
Hairy,a.,Bearing or covered with hair; made of or resembling hair; rough with hair; rough with hair; rough with hair; hirsute.
Hakim,n.,"A wise man; a physician, esp. a Mohammedan."
Haled,imp. & p. p.,of Hale
Halma,n.,"The long jump, with weights in the hands, -- the most important of the exercises of the Pentathlon."
Halos,pl. ,of Halo
Halse,v. t.,To embrace about the neck; to salute; to greet.
Halve,n.,A half.
Halwe,n.,A saint.
Hamel,v. t.,Same as Hamele.
Hanap,n.,"A rich goblet, esp. one used on state occasions."
Hance,v. t.,To raise; to elevate.
Hanch,,See Hanse.
Handy,superl.,Performed by the hand.
Hanse,n.,That part of an elliptical or many-centered arch which has the shorter radius and immediately adjoins the impost.
Han't,,"A contraction of have not, or has not, used in illiterate speech. In the United States the commoner spelling is hain't."
Haply,adv.,"By hap, chance, luck, or accident; perhaps; it may be."
Happy,superl.,"Favored by hap, luck, or fortune; lucky; fortunate; successful; prosperous; satisfying desire; as, a happy expedient; a happy effort; a happy venture; a happy omen."
Hards,n. pl.,The refuse or coarse part of fiax; tow.
Hardy,a.,Bold; brave; stout; daring; resolu?e; intrepid.
Harem,n.,The apartments or portion of the house allotted to females in Mohammedan families.
Harle,n.,The red-breasted merganser.
Harns,n. pl.,The brains.
Harpa,n.,"A genus of marine univalve shells; the harp shells; -- so called from the form of the shells, and their ornamental ribs."
Harpy,n.,"A fabulous winged monster, ravenous and filthy, having the face of a woman and the body of a vulture, with long claws, and the face pale with hunger. Some writers mention two, others three."
Harre,n.,A hinge.
Harry,v. t.,"To strip; to lay waste; as, the Northmen came several times and harried the land."
Harsh,a.,Rough; disagreeable; grating
Haste,n.,"Celerity of motion; speed; swiftness; dispatch; expedition; -- applied only to voluntary beings, as men and other animals."
Hasty,n.,"Involving haste; done, made, etc., in haste; as, a hasty sketch."
Hatch,v. t.,To cross with lines in a peculiar manner in drawing and engraving. See Hatching.
Hated,imp. & p. p.,of Hate
Hatel,a.,Hateful; detestable.
Hater,n.,One who hates.
Hatte,,"pres. &amp; imp. sing. &amp; pl. of Hote, to be called. See Hote."
Haugh,n.,A low-lying meadow by the side of a river.
Haulm,n.,"The denuded stems or stalks of such crops as buckwheat and the cereal grains, beans, etc.; straw."
Hauls,n.,See Hals.
Hault,a.,Lofty; haughty.
Haunt,v. t.,To frequent; to resort to frequently; to visit pertinaciously or intrusively; to intrude upon.
Haven,n.,"A bay, recess, or inlet of the sea, or the mouth of a river, which affords anchorage and shelter for shipping; a harbor; a port."
Haver,n.,A possessor; a holder.
Havoc,n.,Wide and general destruction; devastation; waste.
Hawed,imp. & p. p.,of Haw
Hawse,n.,A hawse hole.
Hazed,imp. & p. p.,of Haze
Hazel,n.,"A shrub or small tree of the genus Corylus, as the C. avellana, bearing a nut containing a kernel of a mild, farinaceous taste; the filbert. The American species are C. Americana, which produces the common hazelnut, and C. rostrata. See Filbert."
Hazle,v. t.,To make dry; to dry.
Heady,a.,Willful; rash; precipitate; hurried on by will or passion; ungovernable.
Heald,n.,A heddle.
Heapy,a.,Lying in heaps.
Heard,imp. & p. p.,of Hear
Heart,n.,"A hollow, muscular organ, which, by contracting rhythmically, keeps up the circulation of the blood."
Heath,n.,"A low shrub (Erica, / Calluna, vulgaris), with minute evergreen leaves, and handsome clusters of pink flowers. It is used in Great Britain for brooms, thatch, beds for the poor, and for heating ovens. It is also called heather, and ling."
Hoven,,of Heave
Heave,v. t.,"To cause to move upward or onward by a lifting effort; to lift; to raise; to hoist; -- often with up; as, the wave heaved the boat on land."
Heavy,a.,Having the heaves.
Heben,n.,Ebony.
Hedge,n.,"A thicket of bushes, usually thorn bushes; "
Heedy,a.,Heedful.
Hefty,a.,Moderately heavy.
Hegge,n.,A hedge.
Helix,n.,"A nonplane curve whose tangents are all equally inclined to a given plane. The common helix is the curve formed by the thread of the ordinary screw. It is distinguished from the spiral, all the convolutions of which are in the plane."
Hello,interj. & n.,See Halloo.
Helly,a.,Hellish.
Helot,n.,"A slave in ancient Sparta; a Spartan serf; hence, a slave or serf."
Helve,n.,"The handle of an ax, hatchet, or adze."
Hema-,,Same as Haema-.
Hemal,a.,"Relating to the blood or blood vessels; pertaining to, situated in the region of, or on the side with, the heart and great blood vessels; -- opposed to neural."
Hemi-,,A prefix signifying half.
Hemin,n.,"A substance, in the form of reddish brown, microscopic, prismatic crystals, formed from dried blood by the action of strong acetic acid and common salt; -- called also Teichmann's crystals. Chemically, it is a hydrochloride of hematin."
Hemo-,,"Same as Haema-, Haemo-."
Hempy,a.,Like hemp.
Hence,adv.,From this place; away.
Hende,a.,Skillful; dexterous; clever.
Hendy,a.,See Hende.
Henen,adv.,Hence.
Henna,n.,A thorny tree or shrub of the genus Lawsonia (L. alba). 
Henry,n.,"The unit of electric induction; the induction in a circuit when the electro-motive force induced in this circuit is one volt, while the inducing current varies at the rate of one ampere a second."
Hente,imp.,of Hent
Hepar,n.,"Liver of sulphur; a substance of a liver-brown color, sometimes used in medicine"
Hepta,,"A combining form from Gr. ""epta`, seven."
Herby,a.,"Having the nature of, pertaining to, or covered with, herbs or herbage."
women,pl. ,of Herdswoman
Heren,a.,Made of hair.
Herie,v. t.,To praise; to worship.
Herma,n.,"See Hermes, 2."
Herne,n.,A corner.
Heron,n.,"Any wading bird of the genus Ardea and allied genera, of the family Ardeidae."
Herse,n.,"A kind of gate or portcullis, having iron bars, like a harrow, studded with iron spikes. It is hung above gateways so that it may be quickly lowered, to impede the advance of an enemy."
Herte,n.,A heart.
Heugh,n.,A crag; a cliff; a glen with overhanging sides.
Heved,n.,The head.
Hewed,imp.,of Hew
Hewer,n.,One who hews.
Hexad,n.,"An atom whose valence is six, and which can be theoretically combined with, substituted for, or replaced by, six monad atoms or radicals; as, sulphur is a hexad in sulphuric acid. Also used as an adjective."
Hexyl,n.,"A compound radical, C6H13, regarded as the essential residue of hexane, and a related series of compounds."
Heygh,a.,High.
Heyne,n.,A wretch; a rascal.
Hided,imp. & p. p.,of Hide
Hider,n.,One who hides or conceals.
Hying,p. pr. & vb. n.,of Hie
Hiems,n.,Winter.
Hight,n.,A variant of Height.
Hoten,,of Hight
Higre,n.,See Eagre.
Hijra,n.,See Hegira.
Hilal,a.,Of or pertaining to a hilum.
Hilar,a.,Belonging to the hilum.
Hilly,a.,"Abounding with hills; uneven in surface; as, a hilly country."
Hilum,n.,The eye of a bean or other seed; the mark or scar at the point of attachment of an ovule or seed to its base or support; -- called also hile.
Hilus,n.,"Same as Hilum, 2."
Hindi,n.,"The name given by Europeans to that form of the Hindustani language which is chiefly spoken by native Hindoos. In employs the Devanagari character, in which Sanskrit is written."
Hindu,n.,A native inhabitant of Hindostan. As an ethnical term it is confined to the Dravidian and Aryan races; as a religious name it is restricted to followers of the Veda.
Hinge,n.,"The hook with its eye, or the joint, on which a door, gate, lid, etc., turns or swings; a flexible piece, as a strip of leather, which serves as a joint to turn on."
Hinny,v. i.,To neigh; to whinny.
Hipps,n.,"See Hyp, n."
Hippa,n.,Alt. of Hippe
Hippe,n.,"A genus of marine decapod crustaceans, which burrow rapidly in the sand by pushing themselves backward; -- called also bait bug. See Illust. under Anomura."
Hired,imp. & p. p.,of Hire
Hirer,n.,One who hires.
Hires,pron.,Alt. of Hirs
Hitch,v. t.,To become entangled or caught; to be linked or yoked; to unite; to cling.
Hithe,n.,"A port or small haven; -- used in composition; as, Lambhithe, now Lambeth."
Hived,imp. & p. p.,of Hive
Hiver,n.,One who collects bees into a hive.
Hives,n.,The croup.
Hoard,n.,"See Hoarding, 2."
Hoary,a.,White or whitish.
Hobby,n.,"A small, strong-winged European falcon (Falco subbuteo), formerly trained for hawking."
Hobit,n.,"A small mortar on a gun carriage, in use before the howitzer."
Hoboy,n.,A hautboy or oboe.
Hocco,n.,The crested curassow; -- called also royal pheasant. See Curassow.
Hough,n.,"The joint in the hind limb of quadrupeds between the leg and shank, or tibia and tarsus, and corresponding to the ankle in man."
Hocus,v. t.,To deceive or cheat.
Hoddy,n.,"See Dun crow, under Dun, a."
Hoful,a.,Careful; wary.
Hoise,v. t.,To hoist.
Hoist,v. t.,"To raise; to lift; to elevate; esp., to raise or lift to a desired elevation, by means of tackle, as a sail, a flag, a heavy package or weight."
Hoker,n.,Scorn; derision; abusive talk.
Holla,interj.,Hollo.
Hollo,interj. & n.,"Ho there; stop; attend; hence, a loud cry or a call to attract attention; a halloo."
Holly,adv.,Wholly.
Holo-,,"A combining form fr. Gr. ""o`los whole."
Holwe,a.,Hollow.
Homer,n.,A carrier pigeon remarkable for its ability to return home from a distance.
Homo-,,"A combining form from Gr. ""omo`s, one and the same, common, joint."
Honed,imp. & p. p.,of Hone
Honey,n.,"A sweet viscid fluid, esp. that collected by bees from flowers of plants, and deposited in the cells of the honeycomb."
Honor,n.,Esteem due or paid to worth; high estimation; respect; consideration; reverence; veneration; manifestation of respect or reverence.
Hoody,n.,"The hooded crow; also, in Scotland, the hooded gull."
Hoofs,pl. ,of Hoof
Hooky,a.,Full of hooks; pertaining to hooks.
Hoove,n.,"A disease in cattle consisting in inflammation of the stomach by gas, ordinarily caused by eating too much green food; tympany; bloating."
Hoped,imp. & p. p.,of Hope
Hoper,n.,One who hopes.
Hoppo,n.,"A collector of customs, as at Canton; an overseer of commerce."
Horal,a.,"Of or pertaining to an hour, or to hours."
Horde,n.,"A wandering troop or gang; especially, a clan or tribe of a nomadic people migrating from place to place for the sake of pasturage, plunder, etc.; a predatory multitude."
Horny,superl.,Having horns or hornlike projections.
Horse,n.,A hoofed quadruped of the genus Equus; 
Horsy,a.,"Pertaining to, or suggestive of, a horse, or of horse racing; as, horsy manners; garments of fantastically horsy fashions."
Hosen,pl. ,of Hose
Hotel,n.,"A house for entertaining strangers or travelers; an inn or public house, of the better class."
Hotly,a.,"In a hot or fiery manner; ardently; vehemently; violently; hastily; as, a hotly pursued."
Hoult,n.,A piece of woodland; a small wood. [Obs.] See Holt.
Hound,n.,"A variety of the domestic dog, usually having large, drooping ears, esp. one which hunts game by scent, as the foxhound, bloodhound, deerhound, but also used for various breeds of fleet hunting dogs, as the greyhound, boarhound, etc."
Houri,n.,A nymph of paradise; -- so called by the Mohammedans.
Hours,n. pl.,"Goddess of the seasons, or of the hours of the day."
House,n.,"A structure intended or used as a habitation or shelter for animals of any kind; but especially, a building or edifice for the habitation of man; a dwelling place, a mansion."
Houss,n.,A saddlecloth; a housing.
Houve,n.,A head covering of various kinds; a hood; a coif; a cap.
Hovel,n.,"An open shed for sheltering cattle, or protecting produce, etc., from the weather."
Hover,n.,A cover; a shelter; a protection.
Howdy,n.,A midwife.
Howel,n.,"A tool used by coopers for smoothing and chamfering rheir work, especially the inside of casks."
Howso,adv.,Howsoever.
Howve,n.,A hood. See Houve.
Hubby,a.,"Full of hubs or protuberances; as, a road that has been frozen while muddy is hubby."
Hudge,n.,An iron bucket for hoisting coal or ore.
Huffy,a.,"Puffed up; as, huffy bread."
Hulan,n.,See Uhlan.
Hulch,n.,A hunch.
Hulky,a.,Bulky; unwiedly.
Hullo,interj.,See Hollo.
Hully,a.,Having or containing hulls.
Human,a.,"Belonging to man or mankind; having the qualities or attributes of a man; of or pertaining to man or to the race of man; as, a human voice; human shape; human nature; human sacrifices."
Humic,a.,"Pertaining to, or derived from, vegetable mold; as, humic acid. See Humin."
Humid,a.,"Containing sensible moisture; damp; moist; as, a humidair or atmosphere; somewhat wet or watery; as, humid earth; consisting of water or vapor."
Humin,n.,"A bitter, brownish yellow, amorphous substance, extracted from vegetable mold, "
Humor,n.,"Moisture, especially, the moisture or fluid of animal bodies, as the chyle, lymph, etc.; as, the humors of the eye, etc."
Humph,interj.,"An exclamation denoting surprise, or contempt, doubt, etc."
Humpy,a.,Full of humps or bunches; covered with protuberances; humped.
Humus,n.,That portion of the soil formed by the decomposition of animal or vegetable matter. It is a valuable constituent of soils.
Hunch,n.,A hump; a protuberance.
Hunks,n.,"A covetous, sordid man; a miser; a niggard."
Hunte,n.,A hunter.
Hurds,n.,The coarse part of flax or hemp; hards.
Hurly,n.,Noise; confusion; uproar.
Hurra,interj.,"A word used as a shout of joy, triumph, applause, encouragement, or welcome."
Hurry,v. t.,To hasten; to impel to greater speed; to urge on.
Hurst,n.,"A wood or grove; -- a word used in the composition of many names, as in Hazlehurst."
Husky,n.,Abounding with husks; consisting of husks.
Hussy,n.,A housewife or housekeeper.
Hutch,v. t. & i.,"To place in huts; to live in huts; as, to hut troops in winter quarters."
Huzza,interj.,"A word used as a shout of joy, exultation, approbation, or encouragement."
Hyads,n.pl.,"A cluster of five stars in the face of the constellation Taurus, supposed by the ancients to indicate the coming of rainy weather when they rose with the sun."
Hydr-,,See under Hydro-.
Hydra,n.,"A serpent or monster in the lake or marsh of Lerna, in the Peloponnesus, represented as having many heads"
Hyena,n.,"Any carnivorous mammal of the family Hyaenidae, of which three living species are known. They are large and strong, but cowardly. They feed chiefly on carrion, and are nocturnal in their habits."
Hylic,a.,"Of or pertaining to matter; material; corporeal; as, hylic influences."
Hymar,n.,The wild ass of Persia.
Hymen,n.,A fold of muscous membrane often found at the orifice of the vagina; the vaginal membrane.
Hyoid,a.,"Having the form of an arch, or of the Greek letter upsilon [/]."
Hypo-,,"A prefix signifying a less quantity, or a low state or degree, of that denoted by the word with which it is joined, or position under or beneath."
Hyrax,n.,"Any animal of the genus Hyrax, of which about four species are known. "
Hyrse,n.,Millet.
Hyrst,n.,A wood. See Hurst.
Hyson,n.,A fragrant kind of green tea.
Hythe,n.,A small haven. See Hithe.</BODY></HTML>
Iambi,pl. ,of Iambus
Jabot,n.,"Originally, a kind of ruffle worn by men on the bosom of the shirt."
Jacob,n.,"A Hebrew patriarch (son of Isaac, and ancestor of the Jews), who in a vision saw a ladder reaching up to heaven (Gen. xxviii. 12); -- also called Israel."
Jaded,imp. & p. p.,of Jade
Jager,n.,A sharpshooter. See Yager.
Jaggy,a.,"Having jags; set with teeth; notched; uneven; as, jaggy teeth."
Jaina,n.,"One of a numerous sect in British India, holding the tenets of Jainism."
Jakes,n.,A privy.
Jakie,n.,"A South American striped frog (Pseudis paradoxa), remarkable for having a tadpole larger than the adult, and hence called also paradoxical frog."
Jalap,n.,"The tubers of the Mexican plant Ipomoea purga (or Exogonium purga), a climber much like the morning-glory. "
Jantu,n.,"A machine of great antiquity, used in Bengal for raising water to irrigate land."
Janty,a.,See Jaunty.
Janus,n.,A Latin deity represented with two faces looking in opposite directions. 
Japan,n.,"Work varnished and figured in the Japanese manner; also, the varnish or lacquer used in japanning."
Japer,n.,A jester; a buffoon.
Jards,n.,"A callous tumor on the leg of a horse, below the hock."
Jarvy,n.,The driver of a hackney coach.
Jasey,n.,"A wig; -- so called, perhaps, from being made of, or resembling, Jersey yarn."
